{
  "schemaVersion": "1",
  "kind": "sparse-experiment-implementation-manifest/v1",
  "algorithm": "sha256",
  "files": [
    {
      "path": "Directory.Build.props",
      "sha256": "a4c9e69de8b7cd5725ce78251697b242deefdc5406b7b24f1440ce2e86be26d3"
    },
    {
      "path": "Directory.Packages.props",
      "sha256": "0abf4c071938be7bad8ff140be12e32ff2c4293ac5870b6454b65ea346a43fd7"
    },
    {
      "path": "global.json",
      "sha256": "0588e32d44bdf884e0305ded21820b13a59b1518efd39976c34d909eff3b1044"
    },
    {
      "path": "src/SarifRegress.Cli/Benchmarking/BenchmarkContracts.cs",
      "sha256": "175e0281201875e3a4f8fdea91e03ec0df8ee4d25f369181f1258f997497cdf8"
    },
    {
      "path": "src/SarifRegress.Cli/Benchmarking/BenchmarkDatasetGenerator.cs",
      "sha256": "a4b803f66f74428434e1371cdd2a52d9abd0c6a113e4b8672d97c4311b956f6b"
    },
    {
      "path": "src/SarifRegress.Cli/Benchmarking/BenchmarkReportSerializer.cs",
      "sha256": "f4092a6b4c9ebf66aa0ed7e748bf8dc5eec48a690dfd319612e942bdbc51da7a"
    },
    {
      "path": "src/SarifRegress.Cli/Benchmarking/BenchmarkRunner.cs",
      "sha256": "c5c6e30fff02915db9cd5391e4ffa7b26e0af4bed3bde7c1205d40135e996274"
    },
    {
      "path": "src/SarifRegress.Cli/CliApplication.cs",
      "sha256": "08c6778cfe140bda71cbfdd31e2d754bc82e1e98159834e9b2afeff39acbd5ae"
    },
    {
      "path": "src/SarifRegress.Cli/CommandLine/AtomicOutputWriter.cs",
      "sha256": "c0e72490fecf757310e22c6b6af1ae1b583f8ee22469d67666b9f8bc4cd9c730"
    },
    {
      "path": "src/SarifRegress.Cli/CommandLine/BenchCommandFactory.cs",
      "sha256": "41d27ca306d6eb926b48a0dbc8f945fc2df49d19c7136099fc0efefe60b81795"
    },
    {
      "path": "src/SarifRegress.Cli/CommandLine/BenchCommandHandler.cs",
      "sha256": "13f31f80e19f0b74156ed38c4c7354442849b2b08bfdd0d7be89c8a0b28f57b8"
    },
    {
      "path": "src/SarifRegress.Cli/CommandLine/BenchCommandRequest.cs",
      "sha256": "98a99dcac9e37e629e796cff2c8822ae9c564f8141650512597ca910594c087f"
    },
    {
      "path": "src/SarifRegress.Cli/CommandLine/CanonicaliseCommandFactory.cs",
      "sha256": "35238ac3232caa795de9444f29528f7faf9395bb62ebd804f665cf0304f4e4d3"
    },
    {
      "path": "src/SarifRegress.Cli/CommandLine/CanonicaliseCommandHandler.cs",
      "sha256": "6c8b105cab305ad25d9516bcfe90090fef4d66539250fc7e00ad19330c30dc9a"
    },
    {
      "path": "src/SarifRegress.Cli/CommandLine/CanonicaliseCommandRequest.cs",
      "sha256": "bb3f0fa03410ba28c858323e3cce15f898f22f6e1b1bf78efb8027e713fe6bdd"
    },
    {
      "path": "src/SarifRegress.Cli/CommandLine/CanonicaliseSarifSerializer.cs",
      "sha256": "eddac8a9a3dfc8cbd5bfebd917e643ada6e72d9e103df62ad142ba5eb4b53c0e"
    },
    {
      "path": "src/SarifRegress.Cli/CommandLine/CliCommandFactory.cs",
      "sha256": "48bff73c6419c03672cff846df5fd8d82ceb266c92d39ef29d1724222c51eacd"
    },
    {
      "path": "src/SarifRegress.Cli/CommandLine/CompareCommandFactory.cs",
      "sha256": "d4ad4b40fac07445fab7631f35ea9be2993fa11d02cb30658a394646fbadab7c"
    },
    {
      "path": "src/SarifRegress.Cli/CommandLine/CompareCommandHandler.cs",
      "sha256": "505a97d1f93f77bf60245859826dbc416c8187cbd6c57125ea583d457572b6ab"
    },
    {
      "path": "src/SarifRegress.Cli/CommandLine/CompareCommandRequest.cs",
      "sha256": "c076af5d07281a47a04485864337a4f7a5118a00c021493c942a3030155592a0"
    },
    {
      "path": "src/SarifRegress.Cli/CommandLine/CorpusCommandFactory.cs",
      "sha256": "938934a9b053db60906aa018a781b7f0893cb1471ff696a580196d36e515a2d7"
    },
    {
      "path": "src/SarifRegress.Cli/CommandLine/CorpusCommandHandler.cs",
      "sha256": "a11c96cd009e990daf8d743f8f496d6b40dbda5d12033de922344fcc3cc0f393"
    },
    {
      "path": "src/SarifRegress.Cli/CommandLine/CorpusCommandRequest.cs",
      "sha256": "ae3b1ad965dc31bd6d0e82d8d27feddd258060826d40c8c8ba5e1c6fea1c87d0"
    },
    {
      "path": "src/SarifRegress.Cli/CommandLine/PathIdentityResolver.cs",
      "sha256": "88fa098360c2fc1fd21e976eaf1c4f9d5a94fab21c11f043db9dd89f80c18058"
    },
    {
      "path": "src/SarifRegress.Cli/CommandLine/ValidateCommandFactory.cs",
      "sha256": "180273dec34546d9874c40841a668af08faf438dd834cf0c2835bc982a01c7d3"
    },
    {
      "path": "src/SarifRegress.Cli/CommandLine/ValidateCommandHandler.cs",
      "sha256": "02fc965177981e2fa0ab66ac199314225bc1d364a18c1d3d1a5d9ef0dc22ca83"
    },
    {
      "path": "src/SarifRegress.Cli/CommandLine/ValidateCommandRequest.cs",
      "sha256": "23faec6cfb3e67d70194933e848b546e211662cc517eae1367b093138e612bf0"
    },
    {
      "path": "src/SarifRegress.Cli/CommandLine/ValidateCommandSupport.cs",
      "sha256": "39679c1abd13fb29c316096e03ee43699a80179a44b824b8d43df135ff45b67b"
    },
    {
      "path": "src/SarifRegress.Cli/CommandLine/ValidateSummarySerializer.cs",
      "sha256": "f85fd3d3b906a91713a1693d60aa3aeec73ea005abcc22542fcaeb5695c79e98"
    },
    {
      "path": "src/SarifRegress.Cli/Corpus/CorpusCaseArtifactSerializer.cs",
      "sha256": "e0f32885effb368273c03808400889ea121d617a14ce7617d5ac5f917dba9254"
    },
    {
      "path": "src/SarifRegress.Cli/Corpus/CorpusContracts.cs",
      "sha256": "d85c70a17c816617587bca238e81a5bcf7e33026ea59f515011b02c027366b44"
    },
    {
      "path": "src/SarifRegress.Cli/Corpus/CorpusEvaluator.cs",
      "sha256": "b9de1aa17ac4c46317a67511cffc28fb9930cbf71263d990c511715c9294cbec"
    },
    {
      "path": "src/SarifRegress.Cli/Corpus/CorpusExpectationEvaluator.cs",
      "sha256": "84140127584187b1e3aaee6128aff87618f1af7b593425cd379455fcba907609"
    },
    {
      "path": "src/SarifRegress.Cli/Corpus/CorpusLabelReader.cs",
      "sha256": "11ee36409a8ca854ab59fa51042622712d8e3d50dafd995939b005cd5f104f42"
    },
    {
      "path": "src/SarifRegress.Cli/Corpus/CorpusQualityGate.cs",
      "sha256": "ed0a429ec164c21701fad6311bcd368d2c297f967b919b00985370d746a7679c"
    },
    {
      "path": "src/SarifRegress.Cli/Corpus/CorpusRunReportSerializer.cs",
      "sha256": "d92b988bfcfc87440aef97b8a57e2c8aff2cb5c5a2709f2f8e8bbbdc32a5af59"
    },
    {
      "path": "src/SarifRegress.Cli/Corpus/CorpusRunner.cs",
      "sha256": "529339063bff42d93f1cc1864cec54cbff4db376fb0637740d25a2449c879b3a"
    },
    {
      "path": "src/SarifRegress.Cli/Diagnostics/StableDiagnosticFormatter.cs",
      "sha256": "14cadd9aa4d827ec8e989d8c67dec81537830ed8f7be6b100762e615b88ff49b"
    },
    {
      "path": "src/SarifRegress.Cli/ExitCodes.cs",
      "sha256": "b8883cbc4a31a9dcf9c14b4f444ec1d144751958d94d0f912106e3efe35a07d5"
    },
    {
      "path": "src/SarifRegress.Cli/Program.cs",
      "sha256": "686b47f19e74b7f01c34f584b3473d02ca7ba4289685a9e0c5664d8d16c208b9"
    },
    {
      "path": "src/SarifRegress.Cli/SarifRegress.Cli.csproj",
      "sha256": "a96346f93bc4f9c488d8f02578e86ef1d18110432760e0c17d5e0ee455ccc1d2"
    },
    {
      "path": "src/SarifRegress.Cli/packages.lock.json",
      "sha256": "0f80024465e6f2d895cd3ac0a50311beebc4d8dc89a0e349a32fb6932615e3c2"
    },
    {
      "path": "src/SarifRegress.Core/Configuration/ConfigurationContracts.cs",
      "sha256": "bed1e54dc2ed9e0967904f1f3dce51aa7f382993cf66421684e9db5b10230bd9"
    },
    {
      "path": "src/SarifRegress.Core/Diagnostics/DiagnosticContracts.cs",
      "sha256": "67f2d6911e45fd9b4498de848baa3cf3c3783f0ff83f504b04801a691bb3cd83"
    },
    {
      "path": "src/SarifRegress.Core/Findings/FindingContracts.cs",
      "sha256": "632734590a9e5cf28d6f65e4d0c46f68756ce5b4aad9cb8865a7202351e9392d"
    },
    {
      "path": "src/SarifRegress.Core/Findings/ProducerIdentityResolver.cs",
      "sha256": "68f468941fbe7e61ab10fccad0297a71a95ea6a80c6207df9cdf40faa76aa5e9"
    },
    {
      "path": "src/SarifRegress.Core/Matching/MatchingContracts.cs",
      "sha256": "90ac3f199b05c704407fe6e6591d3a479f5ef216abee91628ef1b00b57c41d68"
    },
    {
      "path": "src/SarifRegress.Core/Paths/CompletePrefixIndex.cs",
      "sha256": "1528a2bc6c1b186ce2ec47e7d2a7a4a7c3b1f3434e24b3206d551cbad6861cdc"
    },
    {
      "path": "src/SarifRegress.Core/Paths/PathContracts.cs",
      "sha256": "6230cb04350971351e763bf59934ae1ad30a5201bb144304d237ab62979955c1"
    },
    {
      "path": "src/SarifRegress.Core/ProductInformation.cs",
      "sha256": "065f96248a937771c2f4db04f08dc4517cbd59fe888749c1f9169645c1bdf399"
    },
    {
      "path": "src/SarifRegress.Core/Reporting/ReportContracts.cs",
      "sha256": "06e5176ec5bd90bd84c2aedef66ede269f3c4b133fea63ecd16e20b7a73d77c5"
    },
    {
      "path": "src/SarifRegress.Core/SarifRegress.Core.csproj",
      "sha256": "da6362e4e9f1b1cfaa251b4405ddfde0f882008455d49786a5160efc4c9afcc4"
    },
    {
      "path": "src/SarifRegress.Core/Security/ResourceLimits.cs",
      "sha256": "d0c9c41a2a4f666874673039c04ea029a003752998453fdb56b380c226f8f4d0"
    },
    {
      "path": "src/SarifRegress.Core/Utility/VersionedHash.cs",
      "sha256": "f0f850fd1ecf9e9ee7974a0be4e5baa979860973382b4ca7dd97c8fdffb58759"
    },
    {
      "path": "src/SarifRegress.Core/packages.lock.json",
      "sha256": "1624731bf151ec2ac6993023046a4abbac7c6ddc71ed2e242e8285bbc69d561e"
    },
    {
      "path": "src/SarifRegress.Match/BoundedAssignmentSolver.cs",
      "sha256": "208bb61b7694ba8654a9fe4399612765f9796f6a9db715612baa578e1f50ce47"
    },
    {
      "path": "src/SarifRegress.Match/CandidateEdgeFactory.cs",
      "sha256": "3d0e2d139c5a60818ec45332ba54179a78ce5e4db7d0b253a43aabc436a690b0"
    },
    {
      "path": "src/SarifRegress.Match/CodeFlowAnchorOccurrenceIndex.cs",
      "sha256": "e78360fb42a2a23aa9f31d8f7ddc18059e4cedc05023eb2f178589cab0c08fdc"
    },
    {
      "path": "src/SarifRegress.Match/ContextFingerprintOccurrenceIndex.cs",
      "sha256": "6fcea90934ea2ba6cea4e906d98f95f6673c038c2a9a361ebf0e662abfe7b217"
    },
    {
      "path": "src/SarifRegress.Match/FindingMatcher.cs",
      "sha256": "97ff92400ac10a725fb3794cab31a4e433323578cf3b86b17a6a2ff73652687d"
    },